video_id,comment_id,author_display_name,published_at,like_count,comment_text,is_reply,parent_id,channel_id
pVI_smLgTY0,Ugw26ZxF0u45ScFS8PZ4AaABAg,@rosebrigade,2025-05-26T07:25:12Z,0,"So long video short.
AFXLZ7FEJc4,Ugx0uNZ6HvuJXg3zEgp4AaABAg,@Aaaaaa-aaaaaaaaaaaaaaa-aaaaaaa,2025-08-23T18:04:36Z,0,So I should take a trip to Brazil then Asia to get back at that annoying guy in Atlanta…,0,,UC8weZhj3GBxvaB0BmcBA-tA
AFXLZ7FEJc4,UgzDILg3QysaaHvpabB4AaABAg.AM8MAi1zfatAM8cM1433-W,@pamelotms5867,2025-08-22T22:15:34Z,0,​@@ataaronono they are not as far as i know. Also i was making a anime refrence lol.,1,UgzDILg3QysaaHvpabB4AaABAg,UCyBammfTVhLmXO1FhH6vISQ
pVI_smLgTY0,UgyBZsiwBqoADN0OEhN4AaABAg,@RedactedBrainwaves2,2025-04-28T11:21:25Z,0,Mutahar is gonna lose it,0,,UCdCy3tmt4iTdFrmGh0Z4QZg
tZ8ehplVFp4,UgxP2IjSxbmB8_8CCpV4AaABAg,@pauloemarta1768,2025-09-13T15:03:20Z,0,"Lmao that blue shirt guy is so fun, he must be the best friend to have! 😂😂",0,,UCOY9RmSaWGBAs1mRmVLlGvg
wAc9kxOgPxo,Ugxs0WrM3ciiL65nagt4AaABAg.AMji0cDZHaPAMjiNhw47jI,@LinusTechTips,2025-09-06T17:19:22Z,0,Coming soon. Either tomorrow or Monday. - LS,1,Ugxs0WrM3ciiL65nagt4AaABAg,UCXuqSBlHAE6Xw-yeJA0Tunw
u_Lxkt50xOg,UgwisZF9pOcksw7CEQF4AaABAg,@Biltrax2,2025-06-26T20:42:17Z,0,"You can replace tailscale with cloudflare tunnels and zero trust access, i find it a lot more versatile and no need to set up any software on my clients, it works as part of my lab.",0,,UCyuO86YW7CM63Z2T7X0ZIug
OW9Mq3wrEqY,UgyiXqHzqeDwo2NAund4AaABAg,@jamesm-sl3oc,2025-08-28T16:52:46Z,0,Great now we gonna run out of ocean,0,,UCPM7ajVFtsxbPGf6boXNhuA
pVI_smLgTY0,Ugx9pwk_aaIXkl2FDAB4AaABAg,@JohnTravolta-m8y,2025-09-05T07:03:42Z,0,I literally installed linux because of you pewdiepie thank you,0,,UC11rM34uysKZ78YHH3dUjzQ
u_Lxkt50xOg,UgxuW5m40tWYZlkGRQV4AaABAg,@Calamityandfriends,2025-06-28T13:14:35Z,0,"First off, I missed you, dude! 
zQ2ZJuUJeyo,UgzLoqrsWCYHmw0gTCh4AaABAg,@WasteofSpace.,2025-08-29T05:10:21Z,0,how the hell are you gonna get all those out,0,,UCh1TtV-Yv-SwUoway8eSfRQ
5QU20HMPZ3M,UgxqlQfep9n9n3UWVld4AaABAg,@imposteramogus2167,2025-09-10T18:46:19Z,0,"Video ENDS at TWO minutes 
0QrQ_MJdISA,UgwG63Tp_3oynZXI5ph4AaABAg,@Dragonorder18,2025-09-09T04:48:01Z,0,"I mean, I used to have 5 plugged in. But it turned out that a Pure type C monitor was making problems for my PC. But A lot of people would hate how badly they don't match. I mean not just different sizes, but Practically generations except for the main one and the Hyte screen. Although... I was also attempting to see if I can make a multi monitor Steam Deck work. Found a Dock, but need to test it later. But hey, I bet I could compete for how many Tabs I can keep open, while I have the Messy desk like the Craft guy. (And oh shoot. I think I can have another screen if I prepare a remote screen on my ceiling projector! Thanks for the idea after seeing the moving screen info!)",0,,UCUvRpaWllx09HKFafmnTjzw
2JzOe1Hs26Q,UgxvJe9eV5haYwAwvvF4AaABAg.AM5aDgoqDdzAM5kk3mVOZl,@mochaKyu,2025-08-21T19:31:10Z,2,Just watch both...,1,UgxvJe9eV5haYwAwvvF4AaABAg,UCJNqY-ak2AAIQCmAPYgYofg
AFXLZ7FEJc4,Ugz70PtEVugvwOv4Uj14AaABAg,@WillMellquist,2025-08-23T21:52:52Z,0,I don't know why Veritasium's videos are so interesting even though they're so technical.,0,,UCotThpdyuuaE9cnr71frRzg
u_Lxkt50xOg,UgxjoGqdff0mCAvfrm94AaABAg,@cambell9,2025-06-26T23:10:51Z,0,I hate google,0,,UCAfeMaw_D3OArd7_TI4ok1Q
yzSBeCJfhkw,UgzibuS20_DXQ9EkByN4AaABAg,@hegiadi9483,2025-07-31T16:13:09Z,0,Ngl Felix is a natural born entertainer,0,,UCLZ-2f4qmAXrUxwovV5knUA
RQWpF2Gb-gU,Ugx7-1ryP8sT4gT_WOB4AaABAg,@iskda1585,2025-04-30T13:49:15Z,0,the goat posted,0,,UCgJIOveSaRMZca6hgNqTPgw
0QrQ_MJdISA,UgwUHfds5qlFDovrSwJ4AaABAg.AMeZIJnwcUnAMelg5ARIXX,@Taaaamas,2025-09-04T19:12:02Z,4,"Still INCREDIBLY interested in what that's supposed to be, and why it's just sat on the desk
CxVXvFOPIyQ,UgwYJo3S--Q-VYCHUtN4AaABAg,@chupacabra8821,2025-09-03T17:21:07Z,0,"Monsanto, DuPont and all of the special interests do not care about the poison farmers are planting, spraying and “fertilizing/poisoning” our soil with. This is the biggest crime that no one talks about. Sad that “farmers” continue assisting in killing is all.",0,,UCswByawWEDgH_4Wt-oFdW7g
tZ8ehplVFp4,Ugwb-pK4i1f6FIh9xKl4AaABAg,@Kaioin,2025-09-13T22:45:52Z,0,"""Experts at the time knew something had gone wrong..."" Yeah I think us lowly non-experts knew that too, to be fair.",0,,UCG5DUBkZ7CEd_B24TWIO1pw
WZxy6OZRqAE,UgyD3lhnlZaKSHTDg854AaABAg,@benclawson6442,2025-09-10T08:42:47Z,0,4th,0,,UCrbevpZaOl1jGr_WtC8aBAg
4NlrfOl0l8U,UgzBzC7lr7Lj_kMKJHh4AaABAg.ALw32RYxwYaALwTOzcCZut,@flibbertigibbet-at-arms,2025-08-17T19:38:28Z,11,there's Gleam programming language already but it's a nice idea,1,UgzBzC7lr7Lj_kMKJHh4AaABAg,UCLtTJSzpcCNf85RuJz32oNA
CxVXvFOPIyQ,UgxzxR4XmCLoCk9soGt4AaABAg,@IzuAurora,2025-09-01T13:06:47Z,1,People will truly do anythingfor money,0,,UCwgVIQ3dkGhcJv4kKLle7Yg
NTcco6ympRk,UgwIpyRFJ6VRPg58Xpl4AaABAg,@milkbean9141,2025-08-31T15:09:43Z,2828,5:47 SWEDISH: you want to hear the real story then,0,,UCGrgcSHowjb2DpX4Rj4mhCA
Dlsa9EBKDGI,UgxcWG5z0o1UTXpxLtx4AaABAg,@wafikiri_,2025-05-04T14:43:24Z,1,"I don't think the Sudoku example is any good: everyone assumes you know what the rules are to solve a Sudoku puzzle, therefore they obviate them. For me, it's a mystery. Everytime I see a Sudoku puzzle offered to be solved, I skip it.",0,,UCnLAqjRqD0_IVfItzvyLNmw
AGglJehON5g,Ugzo-j6FScenyotisOp4AaABAg,@nicka101,2025-08-15T22:39:02Z,0,Generative AI for code review is just a bad idea,0,,UCPN1AfbLV2DHnHpVKysJuYg
u_Lxkt50xOg,UgyZ2Mhw5WYfjHtahzF4AaABAg,@rivershen8199,2025-06-27T12:26:54Z,0,"2 more months and we're gonna see a collab with Louis Rossman on right to repair, I'm calling it.",0,,UC9OyAt8GwLfOLnYrEXLBI2g
OW9Mq3wrEqY,UgzsgadK9Pi0_CHlPXV4AaABAg,@MikeHuntsPews,2025-08-29T01:56:16Z,0,Salt,0,,UCzUQ5tIIHPqGiIH6dZZozlg
5QU20HMPZ3M,UgwdHtqQd1lj7rilQiJ4AaABAg,@MemesSpices,2025-09-10T15:26:19Z,20,steve dying from creeper is compulsary in every minecraft video,0,,UCaA4P5bvWWecsgytXSr0-YA
zQ2ZJuUJeyo,UgzwNa8xa1KySPiaeFV4AaABAg.AM-yLQBt9izAM0to7JvWeJ,@divaythfyr575,2025-08-19T22:14:10Z,297,Mr. Incrediball.,1,UgzwNa8xa1KySPiaeFV4AaABAg,UCVA6vUjisvhEpZmbw0pX-cg
y2y8ME02lX4,UgyqepPTke-csikOkup4AaABAg,@mehmetbekirbirden6858,2025-08-26T21:58:22Z,0,It was in GI Joe movie.,0,,UCNTcQ-1KRu1kWuvyTYXCETA
qGXtMENJDps,Ugw2ZIb1gEM8nEe6IDl4AaABAg,@badboy333666999,2025-05-16T16:06:07Z,0,sorry marzia i love how u edit,0,,UCVI_MVrCgFPYX2xKqn4w5Gw
zQ2ZJuUJeyo,Ugx06mwDokCSPaD9n954AaABAg,@AndrewHallmon-b6s,2025-08-23T01:49:09Z,0,“Its time to release the balls” is now my quote of the day,0,,UCqO7wATC2sdl34PlZipX1Vw
u_Lxkt50xOg,UgyqFVdMGe6BKFRaD-14AaABAg,@Off_UltraBlueTech,2025-07-07T00:39:14Z,1,Imagine P giving a shoutout to us,0,,UCD4sBra7tNAroNtSgjvFrWA
qGXtMENJDps,UgyDp18ldSFZBx5C8Zh4AaABAg,@OPOOM.,2025-05-27T03:32:50Z,0,예쁘게 생겼군요😊,0,,UCJhBPKWDsTIbuUzhIu_Jl0g
pVI_smLgTY0,UgxEEcCPeifI83Bo8R94AaABAg.AHQQbbKOOCVAHQRnkxD7b3,@MasourakiaChiou,2025-04-27T13:44:00Z,0,They boast about having linux installed but having linux is actually better. Being a vegan isn't,1,UgxEEcCPeifI83Bo8R94AaABAg,UC022hSXMreKmBDb7wPo52Hw
OW9Mq3wrEqY,UgyvOVzOEbNnwhWO-QJ4AaABAg,@SpyricaDragoste,2025-08-28T22:04:18Z,0,""" But using sunlight it's horribly inefficient"" 
u_Lxkt50xOg,UgxpHxpRGBrkLCP4JWR4AaABAg,@SirZeck,2025-06-30T05:06:25Z,0,"I wish I could de-Google, but autofill, photos, and basically the sync are something I'm not willing to give up.",0,,UC2kJ9sLxbQ9JHw5sstAFE-w
za_HO2E3JEU,Ugz1bqfeQ4cje_Wx_CR4AaABAg,@oneworldfamily,2025-08-03T06:36:42Z,0,"You answered your question wrong. Your answer would have been to the question ""how is that?"". The answer to ""why is that?"" is probably because all three of those animals share the same world and have to deal with objects in their environment that are the same size.",0,,UCE6SrWTRmmehT7x6TfIE7Xg
AGglJehON5g,UgzWmyQrFdqLsVbFcI54AaABAg,@kdub6593,2025-08-17T16:42:52Z,0,China is burning.  Which is actually a good thing.,0,,UCmzLigXDWR3XYMQUMMTtFbA
itRV2jEtV8Q,Ugw7CX-XCgpL2A5MrYx4AaABAg.AMP2a0VrqaaAM_A41T8kME,@PetraKann,2025-09-02T14:58:27Z,0,Who said ice-1 is good?,1,Ugw7CX-XCgpL2A5MrYx4AaABAg,UCG1HonQy5Gsf36dIz2-naKg
zQ2ZJuUJeyo,Ugy1S0BvQsWvTZIHeIh4AaABAg,@RyuuGamesFiles,2025-08-19T12:43:57Z,0,"""a lot of balls in my face"" my guy is willing to risk his dignity 😂😂😂",0,,UCb2tQUShYfe-8_wnG4Uzrcg
u_Lxkt50xOg,UgzqvtbFdZHJm1mrvj54AaABAg,@carltonbanks194,2025-07-03T05:34:51Z,0,Duckduckgo was acquired by Microsoft. Bing still tracks all your duckduckgo searches. Rip.,0,,UCQyC-VQ4Zn3_461nau-oNhQ
CxVXvFOPIyQ,UgzLVqBgGUPGyleJWnd4AaABAg,@unitemankind,2025-09-01T04:24:04Z,0,24:35 Do not worry. I will destroy the global system. All countries.,0,,UC6asaHG9xrWReQwgEPtbQMQ
zQ2ZJuUJeyo,UgxgbGfobVdd18aEIrR4AaABAg,@TubeYouDSilvy,2025-08-25T18:46:38Z,0,He went balls deeps,0,,UCeaNVZ9tFCOkU5k7lmH7tuw
yzSBeCJfhkw,UgwRhBKwYDYEog-P8iB4AaABAg.AL5J2BqtrMnAL9Sc9Ma2KH,@Wmann,2025-07-29T09:29:38Z,3,"Man thank goodness I recognised right away too, you can never not recognise those signs.",1,UgwRhBKwYDYEog-P8iB4AaABAg,UCk6IbhquhVOLWE-VrUVD1DQ
qeQCVcBWqis,UgzGBXG38qPzuVyyHUl4AaABAg,@mirzadotdng,2025-09-10T21:27:09Z,0,Is Linus slowly starting to appreciate stuff Apple does well?,0,,UCmXjo_--nks_WGdSeghP-1Q
0XvOOi6g5Ok,Ugy7-Q8RD0UAJTCR1Ph4AaABAg,@Remyueru,2025-08-06T16:46:46Z,0,can someone explain the private equity reference?,0,,UCjbXWAZ9qUc67tMVfPWZyJQ
yzSBeCJfhkw,Ugzu2_SkIxHpY0Khf7p4AaABAg,@saltyy4201,2025-07-30T01:10:22Z,1,UY PILIPINS!!!🇵🇭🇵🇭🇵🇭🦅🦅🦅,0,,UCCOLtf7eO1yiGx0MErj838g
bYkQn2TpF2k,UgxSUOg8SZeDYVru9454AaABAg,@AlexanderPennanen-u1z,2025-09-09T10:04:07Z,1,"Exponentially such an annoyance, just say “erg”!!!",0,,UCLSwrpHMcO3p9KmVf0RycbA
8tx2viHpgA8,UgwfacrrIk87l7I8O_R4AaABAg,@LankyLantern,2025-08-08T17:40:35Z,0,we getting GPT6 before GTA6.,0,,UCVl9bKPHUw1_alq1FQfODCg
8_GgeASwHwQ,Ugy8SCP8Uomf-u0u-GZ4AaABAg,@jimmykimmel784,2025-08-30T09:06:08Z,1,How much is your owner paying you for these ads?,0,,UCNpgi2HZIL-m5pbJ7XsrcvQ
u_Lxkt50xOg,Ugz9z02-gJJs5klwN6Z4AaABAg,@michaelchilcote9821,2025-06-26T19:02:43Z,0,Why is he wearing that cool hat,0,,UC7qihvyeQP1Cf7YgrAm1ROA
u_Lxkt50xOg,UgyvBVAf6VUU6heQEmN4AaABAg,@dedmaxim99,2025-06-27T10:50:25Z,2,Why didn't you buy an old used PC for 30$ instead of using your steamdeck as a server?...,0,,UCrMHx89X71br0aDlzwsLDHQ
u_Lxkt50xOg,UgzjPK6Y3M9ASvxuTF94AaABAg,@Hlidskialf,2025-06-27T20:59:05Z,0,Keepass for password manager lil bro,0,,UCDYO0qWCW4VVMIodlUC2qMA
Lzr9M51N698,Ugz7NVEMBaP33Br-i6F4AaABAg,@pujeetjha8265,2025-09-11T09:04:47Z,0,F 451 is a fun book btw,0,,UC9s15hMSdz33arri4wlSh4A
CxVXvFOPIyQ,UgySG2ndQV-MaiJzXrB4AaABAg,@geoffh4861,2025-09-01T03:12:39Z,2,Watching you guys constantly changing the video thumbnail is so damn cringe.,0,,UCBCuBGmjBRp4quysRTkECQA
WW_7h-lQYio,UgwrHJ4LxuZvyhnLlS14AaABAg.AMrZyZHR7KsAMsQpfPR3DG,@Ravi5ingh,2025-09-10T02:30:28Z,0,​@@zteaxon7787yeah tbh I think that is the reason,1,UgwrHJ4LxuZvyhnLlS14AaABAg,UC8UM0vtlsXIpD2zN7rYIr8Q
xN3aW1Q2aho,Ugx2sGDQGGDHSZ5X-kh4AaABAg,@confudler,2025-09-05T06:28:59Z,0,"I disliked Jira until I took a serious look at the alternatives. Now, if my company tried to take it away and make me use the shitty Microsoft alternative I may actually quit.",0,,UCjKzc9NQfkVr7qt8onzdkjA
CxVXvFOPIyQ,UgzJHoai_Be29kAJSvB4AaABAg,@NickelPlatedPickle,2025-09-03T16:40:58Z,0,Love this video but they are gonna come after you for this one,0,,UCTylXBKRdMWD8oZv8iV3M4w
AGglJehON5g,UgwQM01qUPbhbm535_94AaABAg,@labemolon5739,2025-08-08T12:14:53Z,0,I have 27 year old Sony Lith batteries and they still work with 80-85% of their original capacity. Absolutely phenomenal,0,,UCMHvMi7Nn5Jhie3GOW09HEQ
AFXLZ7FEJc4,UgyCq-U7ccgkimKLFDN4AaABAg,@ToWi1989,2025-09-07T07:26:59Z,0,"If the main reason the fungus spreads so fast is putting the trees too close together, isn't the solution simple then?",0,,UCDhDvGb1QogQDrG5M3StakQ
tZ8ehplVFp4,Ugzil0q6fn-at2b_mu94AaABAg,@lancheloth,2025-09-12T00:56:59Z,0,3:56 many men would try it just for the free brandy 😅,0,,UC7_r5Ik4uXBQcgTvvdmrS_Q
CxVXvFOPIyQ,UgynBEHIqh9N3khhDfh4AaABAg,@carinakaron8068,2025-09-03T02:50:16Z,0,Didnt monsanto get bought out by Bayer???,0,,UCfXBAmjfDA_l4q6ANAsRhGQ
qeQCVcBWqis,Ugw0b9O--krZ8f2HJAN4AaABAg,@kjth2003,2025-09-10T12:22:56Z,0,"The iPhone Air is such a rediculous product with the massive bump... You either: don't use a case and so will keep getting caught going in/out of pockets or you do use as case and so the ""thin-ness"" of the rest of the phone get's lost in the case...
AFXLZ7FEJc4,Ugzt1qH5EsBzNr28bwl4AaABAg,@kozmaz87,2025-08-24T19:58:31Z,0,The video glosses over the atrocity that fordlandia was. On so many levels it was an absolute disgrace.,0,,UCV2s5edUj5qK69beVXTzblw
zQ2ZJuUJeyo,Ugy4bKfpzGUBCdzWVYx4AaABAg,@camille5073,2025-08-25T13:50:38Z,0,"And where are they going after this, to rot in a landfill?",0,,UCDBjDgcNZy_Wl6ae3Z8XfpA
4NlrfOl0l8U,UgyCVeBQEvmpjTVS11t4AaABAg,@AlexSav,2025-08-17T13:48:12Z,1,0:43 is this a AI generated avatar? in the last video you looked different,0,,UCKG0opBXSZc5PpT6AQ8ih9A
CxVXvFOPIyQ,UgwQUj6TbvLJmZ5aX_F4AaABAg,@Thirdlaw1999,2025-09-01T22:37:09Z,0,Excellent episode,0,,UCJvIT0Qrt7ISkXqln8ydClA
CxVXvFOPIyQ,UgzFmtZH-KUO3ee3YtN4AaABAg,@jedbex7070,2025-09-04T01:14:13Z,0,I already knew what they did. But others need to know so liking and commenting to boost the algorithm.,0,,UC_1_sdG-2-j4zVxIaW6dQKw
zQ2ZJuUJeyo,UgyFJCEZOX_5ycz2fiF4AaABAg,@SuburbanMomster,2025-08-24T04:27:07Z,0,"Honestly you did a terrible job showing how ""dangerous"" this was with a giddy smile on your face the whole time making ball jokes. 🙄 Nothing scientific here!",0,,UCVILNUHsWvMGNkOBbexK7Ig
aKx3WqeG3Xc,UgwxZCRfQH9NAy8mSjR4AaABAg,@spookydudeghost,2025-08-27T03:31:54Z,0,(Me getting 0 points) guys i got 4 points on all of them,0,,UCMPQVgYh3rTUP34tvWDl8Bw
u_Lxkt50xOg,UgzUMKodcOLC1TY7XJ54AaABAg,@LilTwix81,2025-06-26T19:29:16Z,1,lol google stocks gonna take a hit because pewds is converting us to the safe side 😂,0,,UCT-83-Kaibxj3rS4OWgBu1g
pVI_smLgTY0,UgyGbrT0quFYyXp_b7d4AaABAg,@vujs5379,2025-04-28T11:26:39Z,1,I can do all this on Windows? Never understood Linux,0,,UC9QI3A7QkzWQEGCu_OPPfWA
miTpJmMt7uo,UgwQk9LBB3E5eIW0pBB4AaABAg,@MalshanPeiris,2025-07-30T17:09:20Z,1,This 72k dataset will be used to train  the best ML model on earth for gossip girl.,0,,UCQ-7FiHMBI8VjoZwbWjCF4A
u_Lxkt50xOg,Ugzohk6ODdAhsVx3cZd4AaABAg,@DeJesusChristianTag,2025-06-26T20:10:43Z,0,"Fuck this shit. Gentlemen, I'll see you on the other side...you know the front line.",0,,UCjcrVoFbdmOxKcrVdMsfFHA
zQ2ZJuUJeyo,UgyexbfL4ZsrfpxB_yR4AaABAg,@ScLeith,2025-08-25T19:03:59Z,0,This must have taken some balls.,0,,UCG8IOIH6X6WH__EZwo-tBEw
u_Lxkt50xOg,Ugzdjt4g0SVPMZWzPSt4AaABAg,@durvlol,2025-07-02T06:15:58Z,0,dear god he found the raspberryPi,0,,UCv8jIcZjDiw-tUiQCPrKYmQ
za_HO2E3JEU,Ugx28t7Td6gdRBLSGBR4AaABAg.AKyb96tQKi1AKyjAGsIFrq,@ScottMichaels-hg3fc,2025-07-24T20:12:06Z,1,What he said,1,Ugx28t7Td6gdRBLSGBR4AaABAg,UClxEkjuyZRVsTKxbN5Mmk4w
pgeTa1PV_40,UgxbuajgcWp4yG052vd4AaABAg,@marsen1106,2025-05-28T15:38:26Z,0,no way engineering arc,0,,UCqw4vhcP6fudh0v59T1iT-A
H5Zj5UAt0ik,Ugw-oPfFqGrtaFd4j_p4AaABAg.AMnpQpGi7DeAMnvDb_rPV5,@MinecraftROOM,2025-09-08T08:28:33Z,0,3🐴🐴🐴,1,Ugw-oPfFqGrtaFd4j_p4AaABAg,UCSbZcXHHHzGEHBsrlfDwhvA
u_Lxkt50xOg,UgwH8dbF7fj8JmJXcxp4AaABAg,@me-ie7ct,2025-06-27T07:44:39Z,0,i like being tracked so i can Traumatize my tec overlords,0,,UC4clel5i-DFxKniEyTdJbHg
uHm6FEb2Re4,Ugwf07wWDa7niMYZgBN4AaABAg,@lejacobofficial,2025-08-14T20:59:37Z,0,"if you dont know what the next 100 second video should be, try doing one for apache cordova",0,,UCzaTSXgqU0dwT9f0oKNRrKg
u_Lxkt50xOg,UgzSyf61Cna0FUQIGvt4AaABAg,@douglasbushong3920,2025-06-27T03:49:42Z,0,"You don't need a password manager.  It's not hard to come up with a password scheme (that you take to your grave) for creating passwords for every service for which you use a password.  Unlike a password manager, such a scheme is unlikely to get hacked or be affected by a data breach.",0,,UCPrwmwaSPZWztCS1xZ524IA
pVI_smLgTY0,UgwuMSt_5axNAdv6YAp4AaABAg,@P0K0,2025-04-29T06:28:41Z,0,22 minutes of content that can actually beat alot so called tech youtubers carreer.,0,,UCZqrZKxGOfQacrhG-76sQkQ
yzSBeCJfhkw,Ugzkw741Edza4yCb7nF4AaABAg,@skrrbaby,2025-07-27T17:24:12Z,177,"13:15 - 13:35
O-3gEsfEm0g,UgwGhlokREs6DAKfe-l4AaABAg.AM5foaBfQIPAM63llN-lHg,@mitchierichie,2025-08-21T22:26:10Z,0,​@@jonatan.cirqueira3925Miracles by ICP,1,UgwGhlokREs6DAKfe-l4AaABAg,UCuiOUQSCUPL7XYLwCHSfT2A
zQ2ZJuUJeyo,UgxOKb8uSI_-Ej2zTXJ4AaABAg,@RillyRandom,2025-08-26T18:36:53Z,0,Omg this video has the pacing of One Piece,0,,UCI--C163BbQNqe8MUKlV2mg
tZ8ehplVFp4,Ugxbxxzt0QvrWn6pVPN4AaABAg,@droj7,2025-09-12T12:59:34Z,0,now do the elevator,0,,UCtGkyoKZGrZUmYDygY1-ZHQ
KZeIEiBrT_w,UgxNGFQVFHJRYD46X5l4AaABAg,@rodux8031,2025-07-26T20:31:29Z,0,Im currently studying computational engineering and we just covered monte carlo integration methods xD,0,,UCpgNmLVxl8cV7fW4x5mhjDg
u_Lxkt50xOg,UgxtvFfEtQwo8a-sTpB4AaABAg,@Darinaligadhvi,2025-07-05T17:10:16Z,0,what do you use for messaging then if not google messages - i ask bc of RCS texting. some GCs and some texts dont go hrough unless i have it bc other people use it.,0,,UCQdSAv82HicfiqYap929WlA
CxVXvFOPIyQ,UgxidSFc_yPgHDglc8B4AaABAg,@rap3208,2025-09-03T11:34:02Z,1,"The medical industry have the Big Pharma, the farming industry have the Big Agri, lol!",0,,UCnGwXKzAeadlXCmWOK5M3sQ
CxVXvFOPIyQ,Ugxpy0fKQUIYgxCuPfp4AaABAg,@markspence3750,2025-09-01T02:10:08Z,0,"If you think this is bad, read about ""Blake Lively v Justin Baldoni.""  Blake is like a ""Monsanto.""",0,,UC3NFZq8SlRKfVdzcxLXYY2w
3YmYnZoj4vY,UgzEjo1chQ26DMQFGOx4AaABAg,@jamesarnett1767,2025-08-29T15:49:39Z,2,He was dead thanks to the brave pilots and their plane.,0,,UCInqF2GZ8qpXic2J6xcL2wg
3foYyPDp0Ho,UgzteR4lfzp-6zbEvqZ4AaABAg,@iskallman5706,2025-05-05T16:07:12Z,9,Hangboard spotted !,0,,UCoa_XKGynPYfp5kuCFE6vjg
AFXLZ7FEJc4,Ugyy38VWY7UsA3TmTnR4AaABAg,@cloudmastr8105,2025-08-31T09:15:54Z,0,"We'll never learn form mistakes. Business people are too narcissistic to take resistance as anything but a personal attack, and react like children who feel undermined. They don't listen to experts because, well, they can ""just see"" better results their way, so eveyone else ""just doesn't understand"" how much ""better"" things could be if they stopped ""trying to have things their way"". They see everything as a battle of wills, and are therefore pretty unfit to be in leadership.",0,,UCjs-Nz8F6D3nvwzw74ua4qw
u_Lxkt50xOg,UgwocNgNpzKsnNGCsYF4AaABAg,@nguyenvu8262,2025-07-07T16:00:08Z,0,Bye bye. Don't come back.,0,,UCrwrewc-L-b5giK2eD9_Ivw
N58JYFkZE7I,Ugzr4oNjOA2Ia-ZFO-Z4AaABAg.AMc1scntueeAMdCcLnlNm1,@Chehoslovak,2025-09-04T04:37:43Z,4,This is assigned against other zombies who are not studying.,1,Ugzr4oNjOA2Ia-ZFO-Z4AaABAg,UChXpNV9aqxBl7STgQrKFmgQ
yzSBeCJfhkw,Ugyt5X7SiSa8YuChxcd4AaABAg,@cadenhanninen,2025-07-30T02:58:23Z,0,Play against Magnus,0,,UCH8-ODt9st0laMUkC6N0u6Q
H5Zj5UAt0ik,UgwJtkJmuiI9HGDZ1Nd4AaABAg,@BNZ_0,2025-09-07T13:02:20Z,0,"They did it, they did that joke 🤣",0,,UC_dBprZvSIPzpsg0ItIjTyg
KZeIEiBrT_w,UgyrdRrbeNb8FesM3Ap4AaABAg,@manuelsilva2648,2025-08-09T16:08:36Z,0,"Interestingly, the Page Rank method is also commonly used in Biology for Functional Networks! It's used to predict relationships between proteins, for example, to determine their relationships with each other in a given system.
pVI_smLgTY0,UgxA69cf4mSHTyzkzxx4AaABAg.AHU6yINy1gjAHVqDQc_Az7,@shioonyi3579,2025-04-29T16:02:18Z,19,I hope it doesnt make you feel bad bro. We all have work to do and need sleep and relax time. Pewds on the other hand got the time and resource to experiment on this.,1,UgxA69cf4mSHTyzkzxx4AaABAg,UC2L6-j4lj5kTssmAVsMju2w
u_Lxkt50xOg,UgyJ8aojcH3rFK0ntGd4AaABAg,@TaanSen-n9e,2025-06-29T13:26:59Z,1,"Who cares just quit , i don't know why YouTube recommend your video.",0,,UC9XwbMlXKZVXne9vmhMVPlg
pgeTa1PV_40,Ugys8o5NH-e4-VHBv-54AaABAg,@nathanielberntson8883,2025-05-31T23:02:15Z,0,"As an engineer, this warms my heart",0,,UCqB8RulFSu-XOH5QKSwJeOw
CxVXvFOPIyQ,Ugw-czg2FqiFBjhzRod4AaABAg.AMcaCPk32wdAMcaTwMtDDL,@belatakibatakacs8470,2025-09-03T22:55:38Z,2,always,1,Ugw-czg2FqiFBjhzRod4AaABAg,UCNh74rBUcGE_X9ZSyOLMf-A
y2y8ME02lX4,UgxQiTATtpicEes65f54AaABAg,@muhammadsaduddin308,2025-08-30T05:38:50Z,0,Dainsleif from gundam,0,,UCLLuQoTnpwjuHb4nkWqAyjg
y2y8ME02lX4,Ugx0EYx9lawc-n8Todd4AaABAg.ALz0WyIixo-AM0HiEfwsft,@Hungabrigoo,2025-08-19T16:32:35Z,3,@@ScottClark-q1r I remember the mythbusters being quite precise in their work...,1,Ugx0EYx9lawc-n8Todd4AaABAg,UCI4kB15tUmhJGuzjFSFgkMQ
tZ8ehplVFp4,Ugy2sjXD-xLIl_otquh4AaABAg,@MrWyzdum,2025-09-12T03:48:22Z,0,"Please Derek, no math",0,,UChfit8JXfQ3apod-RRWvDKQ
AFXLZ7FEJc4,Ugz-Uc8a0gL3XiC3hyV4AaABAg.AM85WJpzsyvAM86Ajug4Nd,@xanderplayz3446,2025-08-22T17:25:40Z,9,Do I see a fellow GregTech player?,1,Ugz-Uc8a0gL3XiC3hyV4AaABAg,UCNqtVPHn42JY_sFbcBlxnRg
pgeTa1PV_40,Ugy9bnaOELmrmcubn114AaABAg,@DominikPrabucki-sx3pi,2025-05-28T15:29:19Z,143,3:18 you wiped your drive didnt you,0,,UCsEFMw0RmsP2aShSbVcTOFg
miTpJmMt7uo,UgzLTCQC4L-AAHnzt2F4AaABAg,@steamyrobotlove,2025-07-30T18:36:53Z,0,Let the vibe coding apocalypse commence!!,0,,UCuKnYvEkrUbaL4XSjX1Bypw
2JzOe1Hs26Q,UgxgBkNRFMwiMLnKpop4AaABAg,@DavideRamboPT,2025-08-26T22:09:57Z,0,PewDiePie is going to give birth to machine God,0,,UCBYEoH8TU5Sk6Wr0cHoGmGw
CxVXvFOPIyQ,UgyMnHi2wW-JEbh6UAx4AaABAg.AMaM-Xx5EinAMaRDFaM1Zt,@MaxCold2,2025-09-03T02:47:29Z,0,And we still have the big pharma,1,UgyMnHi2wW-JEbh6UAx4AaABAg,UCGyHh4YkCdjZzinspVBry-Q
pgeTa1PV_40,UgwfzvtnqTzKgwkH1JJ4AaABAg,@bxlaaa,2025-06-04T19:56:23Z,0,bro made tamagotchi,0,,UCa77GzslQP4BnxndSYeiedw
pVI_smLgTY0,UgyQdPoqBiNyQjyecBx4AaABAg,@JustinPlays2007,2025-04-27T19:55:48Z,0,29.5 BILLION VIEWS for PewDiePie!,0,,UCkji9lzoDHEgfFClesfErTw
5QU20HMPZ3M,UgySvmGrOim8Ro_z81l4AaABAg,@ahsoseggsydog1642,2025-09-11T16:54:00Z,1,New Illagers?!Finally?!,0,,UCjE5xGBOSt2ZWZ_sslVxlsA
tMIDpbmFoL8,Ugxk-k7rIrlE-RgNjsJ4AaABAg,@owenjbirk,2025-04-11T19:21:45Z,0,ni hao fine shyt,0,,UCeFjdtHbIxu4CZ4uQJWMoMg
2JzOe1Hs26Q,UgwwMkgHvaj2D5mCkr54AaABAg,@knorito,2025-08-30T18:14:05Z,0,さいこー！,0,,UCci8irbNN01-BiHC-W_iovw
4T4AoXFDcD8,Ugy8Uvmp-vZ63m7nyuJ4AaABAg,@あかさたな-y8i,2025-08-14T02:34:49Z,0,what a lovely son,0,,UC23qTo-ARK6PoZI2ZVnXc-g
AGglJehON5g,UgweYgUnzsu9rqmHwVJ4AaABAg,@jspiro,2025-08-08T04:34:29Z,0,"Flying back with 100 prototype lithium ion batteries is a bold move, thank goodness nothing happened on that flight or the industry would've been held back yet again.",0,,UCpqgkUu2C4T4sbhp8VPOrJg
pgeTa1PV_40,UgynNN4iRBVN1paO8xF4AaABAg,@sungbokbessell7853,2025-05-29T09:47:43Z,0,Based,0,,UCDEGgWC-nNYO_vYCXaZyXLQ
u_Lxkt50xOg,UgxNCqs_66fDnf4kiVF4AaABAg,@iHelmster,2025-06-27T12:49:43Z,0,"Yahoo mail is worse imo my inbox for every 4 emails i get, i get 3 extra creepy targeted ads that fill the inbox absolute trash email",0,,UCm8jyjyNIdy8HShv2OE1rgQ
u_Lxkt50xOg,Ugyn8ENCjh2Hl2iPYp94AaABAg,@dragonsandfliesandpotatoes,2025-07-24T23:20:53Z,0,Thank you prudiepie!!,0,,UCJBCNB4OPuKvu9C7t2vnkIA
4uqo-brP3xs,UgzBpQB-Xoo9pGsApj14AaABAg,@rhyzhyn,2025-06-15T02:15:40Z,1,17:37  channel emote this 😂😂😂,0,,UCiU_eOGiVP1tyzgwT13nibg
NTcco6ympRk,UgwFWpmKixYUKeoh4mx4AaABAg,@GeoCraftYT4995,2025-08-31T17:17:12Z,0,Jens is back!,0,,UC_3JjmMHyBQMQFcIZS6RU4Q
4T4AoXFDcD8,UgzwcsAK0sPZkpeIzwZ4AaABAg,@akibjawad146,2025-08-10T05:23:38Z,1,Just beautiful,0,,UChaxy8iiKP06IY0mwC-nL2g
H5Zj5UAt0ik,UgxFJg01FsH3AsJhwWh4AaABAg,@shirinpatel9339,2025-09-06T14:50:43Z,0,yum,0,,UCr3ISoOpeabFNDyJgHjtgbQ
AGglJehON5g,Ugydz5kutXVjDMVN2Jh4AaABAg,@kevingo2892,2025-08-07T16:03:44Z,0,"In 1839, a Scottish inventor named Robert Davidson created what is believed to be the world's first electric vehicle – a carriage powered by a motor of his own design and rudimentary, non-rechargeable liquid-acid batteries.",0,,UCIWMvbiKqk1XTYm8wu5sEqQ
AGglJehON5g,UgxSg4zy-t3JNyXkBbd4AaABAg.ALXEKg0fm6jALXFJS_ClCh,@Thoressau,2025-08-07T15:15:07Z,11,Exept without spelling mistakes :),1,UgxSg4zy-t3JNyXkBbd4AaABAg,UC5kjJG-uirdTrUfr4aYGHRQ
za_HO2E3JEU,Ugy2cvaJMXwjXIFkqg14AaABAg,@ArthasDKR,2025-07-26T18:41:50Z,0,"I haven’t seen an elephant jump, math checks out 😂",0,,UC9ErwYdXljFEAV5Buryq3OQ
CxVXvFOPIyQ,UgwjRcp7QLuwxYy6yPF4AaABAg,@_Cyph3r_.,2025-09-03T18:54:08Z,0,"The only thing I don't like about this video are the Russia today clips, while I absolutly believe the dispicable nature of Monsanto, Russia Today is barely a credible source",0,,UC91wYcuPYsKpi9bamScb4jw
u_Lxkt50xOg,UgxCNh4K4y2Q0oqm5FB4AaABAg,@yumeclippi,2025-06-26T20:25:03Z,0,"the best part of switching back to linux is installing xeyes and having multiple instances open with different skins at all times, to recreate that win-google proprietary software feel that people seem to miss once they're untethered from the digital Kali Yuga",0,,UCROqBBKo_7WhdvP2_APnM1A
CxVXvFOPIyQ,Ugz4l4XdXPv4pU20C954AaABAg,@hughmarcus1,2025-09-04T17:18:22Z,0,Isn’t it a good thing that the EU banned GM crops 12 years ago. everyone could see where corporations like Monsanto would go with this once they’d patented their modified seeds.,0,,UCyNyD6TYun0BtU2cFFKF9Ww
Dlsa9EBKDGI,Ugxch2Q7YASDoROY76B4AaABAg,@billabobyt,2025-05-06T10:39:14Z,0,"The sudoku grid at 1:30 has 11,447 solutions so this is already a good example of a function with multiple correct inputs.",0,,UCfAYZWEl6F06_SVUHDdlWZQ
E4Ba84ak570,Ugy-ULR60Ao777yRiZF4AaABAg,@RohtashChahal-bb9st,2025-09-10T01:37:58Z,0,Saitama add please,0,,UCdN2lwkmO2NfklDTsRQVfnw
_a_dY27mlfk,Ugzv3Dmm8OkrSZWdlz94AaABAg,@Clippy7331,2025-08-28T22:00:11Z,1,SOMEHOW people are still gonna find a way to connect this to the end update,0,,UCWreJqxZItGTURuT9sN_HNg
