video_id,comment_id,author_display_name,published_at,like_count,comment_text,is_reply,parent_id,channel_id
Dlsa9EBKDGI,UgzExITqFISEufmHSyx4AaABAg,@JemEklery,2025-05-05T09:32:04Z,1,"I can't believe you didn't predicted that confusion before upload and prerecord this explanation :D
lYDE3oq6fL4,UgwqFsS5weEFSb3Lovp4AaABAg,@ZackMuffinMan,2025-09-08T20:54:17Z,1,"Team Linus blew Team Luke out of the water. It shouldn't have been that close. 
pVI_smLgTY0,UgwDAVVT34zEqVsUVgN4AaABAg,@LewisDecodesAI,2025-05-07T05:58:09Z,0,Protection from hacking is whole new world.,0,,UCWA3dI-DFhEw4gUqRT406sg
ly6YKz9UfQ4,Ugwq335d8ci3_AjI8it4AaABAg,@Echolonious,2025-08-25T23:25:22Z,0,Damn the weed drink hits hard watching these.,0,,UCOBPKqDA_kZ9_ydk7vAjbng
u_Lxkt50xOg,UgyUGn9Cn1eT5qKNPiB4AaABAg,@Babygurl_Basil,2025-07-07T14:56:12Z,1,"Pewdiepie is doing boring dad stuff when hes bored 😂 my husband did this same thing a few years back. 
u_Lxkt50xOg,UgzYGYrnInuawDNERsh4AaABAg,@kanashi_,2025-06-30T07:02:24Z,0,I wish he would address google donating to Israel too,0,,UCFzlFJcJ-TcIhfUkjDWeYuQ
yzSBeCJfhkw,Ugxacc37MJ5g1dUM5JJ4AaABAg,@Basil_lkh,2025-07-28T07:12:11Z,0,One day you well back the topest YouTube channel inshallah,0,,UC2DtPPcSsoqK-QixbJ5xJkw
za_HO2E3JEU,UgxfSrKSM6DAD-6aEDJ4AaABAg,@commiezombie2477,2025-07-24T21:45:23Z,0,"Why do you look so tired,  dehydrated and all swollen in the face? Whats going on with you lately man?",0,,UCAUqrO4wat_DSPcNoO2n5sA
u_Lxkt50xOg,UgxLZvZ3n2GeM0_G_bF4AaABAg,@Ninja_Gaijin,2025-06-29T09:27:52Z,0,86 by 64,0,,UClTSDA7GsizEnVAXNaXrL1Q
X0-TGhktFnE,Ugx68UWzsJME77CVoYB4AaABAg.AMSpHVmU8mBAMV0OsEdbp2,@fredoverflow,2025-08-31T14:57:42Z,1,Is he drinking coke or coffee though?,1,Ugx68UWzsJME77CVoYB4AaABAg,UC9m7D4XKPJqTPCLSBym3BCg
zQ2ZJuUJeyo,UgxYLR5yM7HsqJqKbXV4AaABAg,@Jon-O.,2025-08-24T05:25:35Z,0,Balls meet chin,0,,UCNyWfUlX2tGJnmmrE5CGdAw
tZ8ehplVFp4,Ugxr-gTuO1Ykc0nouoV4AaABAg.AMxyCxE3TynAMzqS8J3ek_,@that_one_momo_guy,2025-09-12T23:37:44Z,89,"His facial expression was everything 😂😂 ""I acknowledge you find this funny and how can I get this over with??""",1,Ugxr-gTuO1Ykc0nouoV4AaABAg,UCr1CaLb_4MQ-_RDxJpJ_5OQ
AGglJehON5g,UgxmNyV2aW1JFPQzrrx4AaABAg,@Terji,2025-08-07T17:18:38Z,0,john be good enough is the fakest name ive ever heard,0,,UC63jC44CDVY7ZqnjUMTxlpw
RQWpF2Gb-gU,UgzIGw9lc76UBXvzPzV4AaABAg,@bitskit3476,2025-05-02T16:30:09Z,0,"I correctly guessed sqrt(N). Probably because I've been saying for years that quantum computers are just over-hyped analog computers, and figured that if quantum states correspond to orientations of a spherical qubit that you'd probably be more likely to see a square root fall out as a consequence of vector arithmetic than to see a logarithmic curve.",0,,UCMCYa_0tOTXhhaA9998MhLw
ly6YKz9UfQ4,UgxQ7PRg1xK50EeMayJ4AaABAg,@hemgreen9984,2025-08-25T19:28:32Z,1,"Is this video talking about projects that were built with AI, or AI projects built with AI?",0,,UC7KrkWF5hBglJh18XmaSQ6Q
za_HO2E3JEU,UgypQAs0l-mlkcjf4pB4AaABAg.AL30xBdM14IAL7hcrSp-LN,@breakingthemasks,2025-07-28T17:11:04Z,0,"​...  I did the research, and from a strictly biological standpoint, above 13-16 feet, walking becomes impossible because the strength isnt there to make controlled walking movements.
CxVXvFOPIyQ,UgyVZmPoh8-kzis2-kF4AaABAg,@paddymccarthy6212,2025-09-01T08:14:25Z,0,"It seems that governments have learned from Monsanto, with regard to controlling the science, re: climate change!
4NlrfOl0l8U,UgymV95mipDJK5WNRxF4AaABAg.ALvtVlvmfpYALw6LJMViay,@freaki0734,2025-08-17T16:16:59Z,5,You are smoking some strong stuff if you think IMO finalists are not better than the vast majority of humans. They are probably better than a majority of specifically mathematics bachelors at this specific kind of problem.,1,UgymV95mipDJK5WNRxF4AaABAg,UCZJ-nE5G4_mFitGphwCA-rQ
CxVXvFOPIyQ,UgzkMhAGxaFdQe165BZ4AaABAg,@Boomtendo4tw,2025-09-08T15:34:52Z,0,Pull a weed or two a day and you'll never have much of a weed problem,0,,UCqVEEM5ZUtchRO_nJfZNuKA
pgeTa1PV_40,UgxnA5Onzvx9_cZ97YF4AaABAg,@m.pluto_o,2025-05-29T06:51:47Z,0,i see how using linux changes your personality to somebody who will buy something to someone who can just make it on their own,0,,UCiV49GW90g4YK_f7xR_r8sA
2JzOe1Hs26Q,UgyMNroKymQodjLkYpR4AaABAg,@Kurtsbainerr,2025-08-21T18:16:46Z,0,What a F N,0,,UC2BWe-J1ZMG6nC88OoFnI4Q
pgeTa1PV_40,UgyXF0xOOiyvCu23oAN4AaABAg,@backslash057,2025-05-29T12:10:05Z,0,Bro. The light at the back is ruining the video quality.....,0,,UCEyql6yWRQ_DgfSUrn1LRaw
AFXLZ7FEJc4,UgzLfdornWVBxeWOhTB4AaABAg,@janpraza1345,2025-08-24T16:04:03Z,0,"blah blah blah, an incomplete bachelor in chemistry to get basic understanding and 2 minutes of GPT search. 
4T4AoXFDcD8,UgzSkSjYJdNSlBVNQqF4AaABAg,@tenglei2,2025-08-12T00:42:32Z,1,Im happy there are japanese comments here. Felix and fam are welcomed!,0,,UCTQi1IJmtgpvpkr-D22V5Nw
Rv9q6kW1vOg,Ugzag48JiFCcURcFeP54AaABAg,@ReidBallardIII,2025-09-10T20:24:37Z,0,If I wanted live reacts in my YouTube videos I would watch Twitch,0,,UCb9d5S6974REnRkSyhv_kug
KZeIEiBrT_w,Ugxr0IDwRhGufT5xYvV4AaABAg,@OttoTheDoge,2025-07-25T22:34:52Z,0,Ugh I was literally about to go sleep... Oh welll...,0,,UCY5vidliS47jpsMzc2NovYg
4T4AoXFDcD8,UgwNzuf61n7OGQKJj5x4AaABAg.ALbbOK3xBNsALbeKg7TYu9,@MaIuar,2025-08-09T17:38:41Z,2,​@@slappedbyafishHe (tbh more of ksi) cried about a Minecraft youtuber who is known for children's mod reviews and cringe minecon moments because they criticised his unhealthy kids food,1,UgwNzuf61n7OGQKJj5x4AaABAg,UC4BFi20zSYdXlRZvKybbN4g
pVI_smLgTY0,UgwElcfJ6DSwnAXgHCh4AaABAg,@salsa83,2025-04-27T03:57:37Z,0,People say if you had enough money to quit working you would be bored. No I would be learning like pewds everyday.,0,,UCbW9WTc8WZfZdNxw32h0ALw
pgeTa1PV_40,UgxuCn-HnMv2pxbniYx4AaABAg,@grand-archibald,2025-06-07T20:42:22Z,1,good to see perfect content very nice,0,,UC2QbxM7mPO5jPYKTOLj2xiA
pVI_smLgTY0,Ugwez9IDBu7e6tSD7lB4AaABAg,@hunterthorne4671,2025-04-27T04:45:03Z,0,"As someone who uses Linux for my job, it is definitely not an operating system for someone who does not have extra time on their hands",0,,UCnNemYkoJGLd_Aj_Gag4OQQ
tZ8ehplVFp4,UgxP6RRFFg487ciKeMZ4AaABAg,@G.r.e.g.g.l.e.s,2025-09-11T22:11:35Z,0,"I've still never heard of a real escalator accident. This was foul play, not an accident!",0,,UCE5rO295sZlM-_Zmv864l9A
zQ2ZJuUJeyo,UgxCDP5emTJd7UBicPJ4AaABAg,@AbareoluwapadeAdegbite,2025-08-26T22:43:57Z,0,I feel bad for the cleaner,0,,UC0Vk7aMwOweqTohe9KhKM4Q
y2y8ME02lX4,UgzlC5Qh0BfO3eszpFd4AaABAg,@Simplyartbydrew,2025-08-24T23:53:45Z,0,I feel like this wasn’t actually that bad of an idea.,0,,UCpUHChxsat6KS1k2cNJjOEQ
4uqo-brP3xs,UgxGkFqtSDLv0ASSN-94AaABAg,@ahtomogger9969,2025-06-17T23:43:56Z,0,This is opposite of homelanders childhood,0,,UCQwFJPvPVoH3Z7ITav-QtMA
pVI_smLgTY0,Ugwv776eM0VwFGoQ7BZ4AaABAg,@Strange9952,2025-04-29T07:14:02Z,0,"Big things are happening, huge, even",0,,UCt5BdigjA-MArKydLtyXdKg
lYDE3oq6fL4,Ugw7uX6ab7lspb2ZGUp4AaABAg.AMoqly5agYjAMot4TlNELc,@HamzaMohamud-ow8my,2025-09-08T17:29:04Z,0,2nd,1,Ugw7uX6ab7lspb2ZGUp4AaABAg,UCz8VSIdPMCo-YfWeRp6SNeA
2JzOe1Hs26Q,UgwFkqXlb6hCcIdDeK54AaABAg,@vermilion4609,2025-08-22T03:33:45Z,0,Pewds bringus ark is fire,0,,UCsOq1YT2n3W7_1VpZz1o0ag
4T4AoXFDcD8,UgxrQfMQtMIz896zLrx4AaABAg,@Themusicguru96,2025-08-16T05:07:05Z,0,"someone should make this an anime, but where pewds bjorn fight monsters lol",0,,UCUC5kkLXmE57SRzAhNDwYxw
MhRGfNkw3Vo,UgyS2kj02Npyh92CzKp4AaABAg,@WestKobeLove,2025-07-19T05:22:31Z,0,"For all parents and especially future parents, this is teaching tape on how to raise a child correctly. Thank you Marzia and Felix!",0,,UCM9s5cEbd-6u0kF0X88TsPA
u_Lxkt50xOg,Ugx6khoDoRZSkPPHDmd4AaABAg,@ramzesthedawn4486,2025-06-26T19:22:38Z,2,"You're never afraid to speak the truth and stand up to bigger names, respect Felix!",0,,UCd-MH7U0T7CHtgxyCTDxZqQ
4NlrfOl0l8U,UgyCWcuxQLZJgFM6ZrR4AaABAg,@manamsetty2664,2025-08-23T06:40:57Z,0,"This technique may just bring so much revolution 🎉
zQ2ZJuUJeyo,UgyWllbEwfsIfqhpl614AaABAg,@Richard-ie1if,2025-08-30T05:50:34Z,0,youd think putting floating solar would beat this out......,0,,UCxD47lAc8SG8DGVYI2x-Xbw
OW9Mq3wrEqY,UgwJc7glMGSNRlUIk0B4AaABAg,@Phillious190,2025-08-29T01:36:53Z,0,It would be much cheaper in the long run to utilise our own oceans than importing water!,0,,UC5ziwy48hax2-vYELzZ4N7g
CxVXvFOPIyQ,UgzqzfSCBiVInkNQtvp4AaABAg,@bernardodancar4606,2025-09-04T00:43:45Z,0,"Kudos, expert journalism, very well done!",0,,UCTZrkMZVYHa3iM_9eOVYcAw
yzSBeCJfhkw,Ugxe6DrLfIfEGhiW2mt4AaABAg,@zbynekurbanek3345,2025-08-03T21:40:20Z,0,I know where Levice is and the best geoguesser in the world doesnt lol :),0,,UCyIzcFlrr_g4W673PtIFGJA
XGmZFNG-qQQ,UgzV1cHA9bdi74Q5Q3Z4AaABAg,@russianbot-d7l,2025-09-04T16:58:07Z,0,Nancy Pelosi is so brilliant. Why is she even in politics when she is such a brilliant investor?,0,,UCNLVMGpWD91jn_Fv3n1UT8A
OW9Mq3wrEqY,Ugz7l_r_DrLl35aa4_Z4AaABAg.AMW_U4w8u4NAMX0gaJajxD,@RawbLV,2025-09-01T09:38:45Z,0,Cost,1,Ugz7l_r_DrLl35aa4_Z4AaABAg,UCdKOizSNms_dpLI0xmzJUMg
u_Lxkt50xOg,UgwLDw-NK9N5Qr1vdpd4AaABAg,@joshuavela3211,2025-06-27T20:23:35Z,0,UNUS ANNUS at the beginning XD,0,,UCuWqqMXc5dmFQXjeyBJsO9w
KZeIEiBrT_w,UgxRrrXks27iB2yRhNF4AaABAg,@zeel6650,2025-07-27T03:39:25Z,0,"when shuffling his deck of cards in the solitaire  game, does the starting position before shuffling the deck impact the next shuffle, therefore impacting the next game. mentioned was ""in solitar the cards from the previous game will not impact the next game"" but at the end of a solitaire game the cards are organized evenly, does how you pack up the cards to reshuffle for the next game impact the deal? if you pack up the cards from one end to the other you might end up with a organized deck, but if you pick random rows to pack up the cards than the starting position for the cards is different.",0,,UCzM2R1v9TLZkw8WsB_my6hw
u_Lxkt50xOg,UgweOs6BnmBIC8_k0EJ4AaABAg,@KuramaMidnight,2025-08-11T14:28:14Z,2,Youtube as lost it Google as also lost it. They gone stupid,0,,UCDexrjazMxkCQ59ibXJxLmQ
CxVXvFOPIyQ,UgwWLx_LS9No_ubqeUt4AaABAg,@ZX9RDan,2025-09-01T14:06:03Z,0,"How about researching the WHO. They are stillnclassifying red meat as cancer Seed (as you mention in this fine video) based on corrupt and flawed studies. 
tZ8ehplVFp4,UgzAo0I18TPu2YwMp994AaABAg,@itspribanerjee,2025-09-12T13:10:59Z,0,This was way too interesting that I expected it to be lol,0,,UCTAhTMwsNGXMhdLK9kzEPPw
CxVXvFOPIyQ,UgzFqa2dRFFR_85jPYF4AaABAg,@vadhakara,2025-09-01T02:37:48Z,0,I think I've seen 3 different thumbnails on this video so far.,0,,UCredbkfDmZczCzHKZ3WBgtQ
HRolyZS8xSg,Ugx-fw_zxs4UzkabAhN4AaABAg.AMfUT3lXB53AMggo26Tc2y,@bpz8175,2025-09-05T13:07:54Z,0,"Radiation isn't magic. 1kg of Plutonium outputs the same total radiation whether you put it all in one box or spread it out over the entire earth.
u_Lxkt50xOg,UgxdiF02AQFIKb7sAJl4AaABAg,@rusteu,2025-06-26T20:16:15Z,0,now wait until he finds out about gentoo. we won't be seeing him for another year atleast...,0,,UC6601br88PGZ_yz80edJyQw
AFXLZ7FEJc4,Ugz43f39akfqDUE3tVN4AaABAg,@aparks1437,2025-08-23T18:51:22Z,0,I might invest into rubber company stocks now.,0,,UCXlJhiPeUiw8q59enSRinKg
MhRGfNkw3Vo,Ugwea5l_09bw7-9vK954AaABAg,@UnluckyLewk,2025-07-22T16:48:59Z,1,Kallade du Börje Salming för Björne?,0,,UCA-xNRS2krWOhlzuYM4CKiw
MhRGfNkw3Vo,UgxG2C3rFtwHpfZAaLl4AaABAg,@eigonojeg,2025-08-01T11:27:21Z,1,6:00 The Huset!! Kungsträdgården!!!,0,,UCwWsU8nAO-heHnFNeJLYXdQ
AFXLZ7FEJc4,Ugw5Dptye-YfBDRpuVp4AaABAg,@vanidar21,2025-08-23T16:24:03Z,0,"We make it in our livers? guys, I have found a revolutionary new way to produce rubber!",0,,UCGa0AcZJLk7dlxsNV7IJidA
iv-5mZ_9CPY,UgyuEAHrymkjdhufiFh4AaABAg,@RenderingUser,2025-07-25T12:28:06Z,18,Thats quite the interesting collab,0,,UCH3ZI35jEJmvBpY9QWl1l4g
uHm6FEb2Re4,Ugw1MOSP4a95u5E9bTl4AaABAg,@0xLostInCode,2025-08-14T18:55:46Z,0,I am so used to everything being AI I was waiting for the part where DuckDB integrates AI.,0,,UC9mSsobsqCOh3EamlRCN-jw
CxVXvFOPIyQ,UgwmbKK_1XnwXjZM0gx4AaABAg.AMuH60YXxXoAMuMOSU4Rqv,@IFIP,2025-09-10T20:30:08Z,0,"It's everywhere. Recommended reading: ""Political Ponerology"" by Lobaczewski. You'll understand what is happening right now, though the book was written decades ago.",1,UgwmbKK_1XnwXjZM0gx4AaABAg,UCaFYbMeu6ZSoohd9OS8GkIw
uHm6FEb2Re4,UgxvplLfGCoysDKsje94AaABAg,@anonymoususer_6969,2025-08-14T18:30:35Z,0,"It's 00:00 in my country rn , let me sleep bro",0,,UCrBdtvZ5_u3_HDdBH0C1v4A
pVI_smLgTY0,Ugy1bQ53NRx2Ytt1Y9B4AaABAg,@lazerTF,2025-04-26T22:56:17Z,0,"distrohopper!!
pgeTa1PV_40,UgwngF7HpO6x-LBcWr94AaABAg,@AnewchallengElise,2025-05-28T15:59:42Z,0,"Nice! Love the builds! 👍🏻
KZeIEiBrT_w,Ugwx7iocYIYQWbXd4Ph4AaABAg,@joshnimako6539,2025-08-23T22:07:42Z,0,nice so get more backlinks,0,,UCQ7Ki9xuipM_waddbALy2Ng
AFXLZ7FEJc4,Ugw9JSQGsoTdl0_aNrJ4AaABAg,@fulstop_,2025-08-23T03:26:22Z,0,not me soyfacing at stress-strain graphs after taking a materials science class,0,,UCyRof27FGq2xq9VwGxbbrwg
AGglJehON5g,UgxviuJrXPNjjwgWXGV4AaABAg,@-MementoMori-,2025-08-13T01:22:11Z,0,"Goodenough believed that, with a better cathode material, he could do better. And that he did.",0,,UCd_TBTOz9-ly9DxskUycKqQ
yzSBeCJfhkw,Ugxi93OcLS9t_MmSf294AaABAg,@SenpaiiiDesu69,2025-08-22T11:55:55Z,0,sip sip pozo nword philippines REPRESENTTTTT,0,,UC_EGnJIT2kcelMOLwzDwG9Q
bYkQn2TpF2k,Ugwdpf4BDl2ZyV5-IzZ4AaABAg.AMoWGwMjnueAMqZ8gjmQ-M,@TheOtherSteel,2025-09-09T09:04:37Z,1,"At the bottom of the screen is a link, ""Geothermal Energy is Changing.""
yzSBeCJfhkw,UgwCvc8OPVet5nm3VqZ4AaABAg,@raileyryle,2025-07-29T05:49:37Z,0,This should be in VR,0,,UCthTDZ4FP9xTVSFHNjZP-MA
2JzOe1Hs26Q,UgyGc5Bi2gIlviTJlGN4AaABAg,@aleeyazmi,2025-09-01T01:51:21Z,0,"okay so i started watching pewdie when i was like 20 something and now im 30 missed out a bit in between due to "" responsibilities"" just stumbled on this video out of nowhere again and dude looks like professor pewdiepie now but the thing is he still the same the edit is the same sound effects are the same and that was amazing tbh 
tMIDpbmFoL8,UgyLpABoFPCmYhA-Il94AaABAg,@mish4m00n,2025-04-11T19:19:06Z,0,This vlogs warms my heart so much. God bless always this family,0,,UCiBKuA8knxLPKrg8URTVWsA
AGglJehON5g,Ugw6NlEUvDOaVxgLVMx4AaABAg.ALXGuO7uN4NALXJ1pQ2wOo,@hdyvdfgcgbbvf,2025-08-07T15:47:40Z,1,😊,1,Ugw6NlEUvDOaVxgLVMx4AaABAg,UCzVGLCXF7TIN4Rv5sGeLecA
NTcco6ympRk,UgyVneT8GS8NOyKw8K54AaABAg,@mediaeduardsonguy2355,2025-08-31T15:16:26Z,0,This Is An UNTOLD Day At Minecraft For A Day Of Real Time.,0,,UCxDhSWiFu0W97ujCPf5CSqg
pgeTa1PV_40,Ugy25VG2c7wgUcn-j_x4AaABAg,@BigG606,2025-05-29T09:59:47Z,1,Pewds need to learn to code,0,,UCKGb4rT68jpX48_cuZ4IzuA
pVI_smLgTY0,UgyTzVXRTeegmECcJY14AaABAg,@sodakarate7242,2025-04-27T10:06:59Z,0,"Please drop the config files, I want to try your hyprland config!",0,,UC6HnutrwtSGYSguSGvckCsw
pgeTa1PV_40,Ugw8hQf8seEB6FmeB1x4AaABAg,@00ValiantFay,2025-09-02T09:58:38Z,0,love this era of pewds,0,,UCGQvQoyZTof4iE7uUU2P__A
qGXtMENJDps,UgxRmnzs8rg7sKFkpf94AaABAg,@でんでん-o4e,2025-05-16T01:23:40Z,1,おはよございます❤,0,,UCffklvlQoAX5P3pD51IMYrQ
CxVXvFOPIyQ,Ugxn3YP8_P_BUE_HqsN4AaABAg,@shr1mple_07,2025-09-01T00:15:38Z,0,Im i crazy or this video change thumbnail every 1 hour,0,,UCSekL25l2Rj-90oqpeuRwPw
CxVXvFOPIyQ,Ugw0ng9GDCUAf0OaYZd4AaABAg,@Aweburn82,2025-09-02T10:32:29Z,1,"I'm surprised people didn't know this. You can make stories like this about many companies. 3M, Dupont, Monsanto.",0,,UCPiVEHRTwxDG4rIk13JNOBw
yzSBeCJfhkw,UgzlxVF-bU8NrePMugR4AaABAg.ALSwDqprArvALT6MHkCZEv,@rawwad,2025-08-06T00:39:55Z,0,"Leviceeeeeeeee and Coop Jednota, f\';[king aye! Fucikova ulica represent!",1,UgzlxVF-bU8NrePMugR4AaABAg,UCTyDiAPhJHgBEArxjOj12UA
pVI_smLgTY0,UgxQkRVfRwgYWWq5tyh4AaABAg,@juancarlosortizdrada,2025-04-28T07:11:37Z,1,Just wait until you set your own homeserver :),0,,UCts34X-denz0AMijHXNNWOQ
u_Lxkt50xOg,Ugyxdqic52zZx-dtmr94AaABAg,@daivion8493,2025-06-28T23:11:49Z,0,Thats why i use bing or yahoo,0,,UCssof7_IeO_bWMgYfsEg3rw
uHm6FEb2Re4,Ugy6PGO1St3WbAiecm54AaABAg,@pedro021,2025-08-14T18:58:07Z,1,"Finally, something worth my time",0,,UCYc51h5fwYFbShzVMSQveJQ
8b3fqIBrNW0,UgylyEqPykATb9k54014AaABAg,@anirudh.7z,2025-09-10T03:30:49Z,1,How do you select every song to perfectly fit the theme,0,,UCHuM9Rp_vhi7OvMcSCbdAUg
4T4AoXFDcD8,Ugz7ifjAUboTzDLOOOt4AaABAg,@JasKyoGreentea,2025-08-11T03:47:01Z,7,"can we mention that despite the flood, the water still looks very clear.. That's how clean Japan isnn",0,,UC3OE_UiPEXcFXMNF6ScdhWA
4uqo-brP3xs,Ugyjnvw_mXf65u7EGzZ4AaABAg,@MissBonnieMcSquirrely,2025-06-27T19:04:31Z,0,your dogs are ridiculous! love!,0,,UCmWluA_yDMdCFzVNHl3Y08Q
lYDE3oq6fL4,Ugxpb53ArtqcMk8KcmF4AaABAg,@Atherax,2025-09-09T02:03:12Z,0,"This was such a fun series, while the over all result for who won was what I expected the scores where so much higher then I thought they would give hahaha 😅",0,,UCu3SgPTO8etLTYZBD-gyosw
KZeIEiBrT_w,UgzpzX7Xoh9PQBAWaIp4AaABAg,@wross012,2025-08-27T06:10:31Z,0,The natural curve never fails,0,,UCR_wCqtjstqw0Zvi2OVFShw
za_HO2E3JEU,UgyyCgjuIEUsGj3gBAB4AaABAg,@silverjohn6037,2025-07-31T03:50:47Z,0,"There's also how far you can safely drop after jumping up.   No matter large or small they will all be at the same velocity as they drop.   Squirrels may be falling several times their own height and horses only half but they'll still be going the same speed coming down.  With no significant evolutionary advantage to jumping higher, only greater risk of taking damage from falling from a greater height, animals evolve to what is safe to do.",0,,UCBEds4mSq1MKQZaTcuT17IQ
y9g31qswBV8,UgxjQnEdAKRNO8zDPwx4AaABAg,@graftongodofmemes,2025-09-06T23:36:59Z,0,"Errrr that's not how "" purging"" with N² works. You're not "" purging"" the dirt and rock away, you're keeping the cutting mechanism oxygen free. You purge the oxygen not the dirt",0,,UCc5bdyX7gLbCruCOgcLiO9A
zQ2ZJuUJeyo,UgxJRQuThCPwFOCK-Tx4AaABAg,@franbalcal,2025-08-19T13:44:37Z,0,Why is he swimming with a shirt on ?,0,,UCN9dB-4dGPIz_1Qk8Pb2d2Q
pVI_smLgTY0,Ugwkepoh3sZuKbVIE9J4AaABAg,@AngryTizzy,2025-04-28T11:09:47Z,1,I tried linux in the past but back then it was too much hassle to get certain programs to work with it and it didnt really work with a lot of games but this video actually made me excited to try it again 😃,0,,UCcpjX7kWVkjMiOZiTTJMtiQ
RQWpF2Gb-gU,UgwnlINorfjvxAzk5bV4AaABAg,@chipiy172,2025-04-30T19:30:43Z,0,"I think Diagonalization might be a good alternative as a one-word summary of this process.
zQ2ZJuUJeyo,Ugxa8IsPWys9QIfTCF94AaABAg,@ToniBingi,2025-08-25T03:03:16Z,0,"This is really stupid. You aren't swimming in balls, you're swimming in water that contains balls. Unless those balls stick together and prevent you from reaching the surface, you're fine. Just tread water and then swim under the balls.",0,,UCQbLbyirH11paozx-7ZgXuA
CxVXvFOPIyQ,UgwVCnc94e_C6iqzCS94AaABAg.AMk4xX5FswbAMkNnWepBMe,@Eldritch-thing,2025-09-06T23:30:02Z,0,"Found the Monsanto CEO 
u_Lxkt50xOg,UgxvznvoXw2MA_PrQb94AaABAg,@Soverax,2025-06-28T08:43:11Z,0,"Linux / BSD for OS for personal PC / home server
3YmYnZoj4vY,UgziCpNodxJ8_CzOyyd4AaABAg,@EricTheOld,2025-09-06T00:05:16Z,0,Split Tail Devil got him,0,,UCEPYqQTQ1ZnwRnZaJgc1ZnQ
MhRGfNkw3Vo,UgzOoy5u3eFm7Qj9Dix4AaABAg.AKj4wP1rxCpAKj8CnNWDQR,@FangiGqngi,2025-07-18T18:51:47Z,1,"weird felling right? We literally grow up with PewDiePie when we were kids, and now that we are older it's hard to understand that future kids won't even know who PewDiePie is and the amount of joy he brought us. There going to have there own thing, and that's such a bittersweet felling you know.",1,UgzOoy5u3eFm7Qj9Dix4AaABAg,UCz8CCjzSYELNXiLCWw2GXfA
CxVXvFOPIyQ,Ugwq-0wy2OeecWgOXPx4AaABAg,@DashHawk,2025-09-08T00:36:17Z,0,after all this you marked middle east as Third world ????,0,,UC77vF_w2YS6L99Zn4_DFiwg
u_Lxkt50xOg,UgxedqI21Kp3ztQIVDR4AaABAg,@sperglordandy4102,2025-07-08T07:52:27Z,0,librewolf. firefox tracks your shit now.,0,,UCQD9UPxb3FFlTdbQB7gbmcg
H5Zj5UAt0ik,Ugx1wbTT812dHmxHJid4AaABAg,@JogandoBem,2025-09-07T01:21:33Z,0,juan.,0,,UCEuqWc6xFyphG_TRBSG0dCQ
tZ8ehplVFp4,UgzhNBP8udPalNNbkYF4AaABAg.AMxBjfmp4R6AMyXycMxN_0,@waynesc-personal,2025-09-12T11:28:18Z,0,yeah idk who this guy is but he's annoying,1,UgzhNBP8udPalNNbkYF4AaABAg,UC7jBsNZf-wRyJkEmDKBrg2A
CxVXvFOPIyQ,UgzNTYrupbcPipFjCd54AaABAg.AMV_5aYNNqqAMVnoiqYW2P,@1DwtEaUn,2025-08-31T22:18:17Z,0,at least Monsanto didn't intentionally give people HIV,1,UgzNTYrupbcPipFjCd54AaABAg,UC-bt1WB8KjlF-Q56_mdlGMg
u_Lxkt50xOg,UgxfHWW_ls7WaR2vGXJ4AaABAg,@Spiritwalking,2025-06-27T08:23:09Z,0,"Proton Pass > Self Hosting
pVI_smLgTY0,UgwLaQGGkXQxe3N49n14AaABAg,@SjorsMaster,2025-04-28T10:37:02Z,0,you would prolly like homeassistant,0,,UCXXnxIOclqzYWLhsyJNnBTg
yzSBeCJfhkw,Ugymj9gtK7Tzn5ocH7B4AaABAg,@Shinosana,2025-08-01T13:15:21Z,0,after i read sip sip poso ***** i knew its philippines already,0,,UCUW-0V0dRfy4RE41WwfImQQ
MhRGfNkw3Vo,Ugzfh_6F7cT8ZIaAmNR4AaABAg,@matteo.franklin,2025-07-18T15:53:57Z,0,Pewds is starting to look like his dad more n more,0,,UC3jfCMOjiJ4lQMHc-pTzBSA
CxVXvFOPIyQ,UgxxnChA6KXqABAurf94AaABAg.AMY_-V9sQ3JAMYdIENxB70,@kolliwanne964,2025-09-02T00:44:03Z,0,I agree. Especially that they did not at all get into contact with EFSA. They are from my experience actually quite open to talk about this stuff.,1,UgxxnChA6KXqABAurf94AaABAg,UCbSGJxhkmRH7T3APqiLlbAQ
OW9Mq3wrEqY,UgxEbKEBnHsi28TUuxd4AaABAg.AMNu1yDjXjcAMQH_8FJUvf,@shadowpenguin3482,2025-08-29T18:51:35Z,1,"To me it looks like it’s not Derek at all, but the VC that bought him using deepfakes to make another moderator look like him.",1,UgxEbKEBnHsi28TUuxd4AaABAg,UCPoT2aWrUxi6rc2QK7mdkjQ
wAc9kxOgPxo,UgxtskFD6aggcmlGb9F4AaABAg,@gasracing5000,2025-09-06T18:41:38Z,2,"@1:40
zQ2ZJuUJeyo,Ugxvaiz9zwv8kTig48t4AaABAg,@suncity3rdcoastshyt...,2025-08-31T05:47:50Z,0,Why wouldn't u b able to swim wit dem in der,0,,UC_HDqnoOXbfHUFN4IJpc5Xw
AGglJehON5g,Ugxvn4ay6oGsjJnpGWF4AaABAg.AM63YYvFlB9AMJy80Ejjht,@RDrumcajsek,2025-08-27T07:57:33Z,11,"He did not discover the graphite, but co-developed a graphite anode. That's a big difference.",1,Ugxvn4ay6oGsjJnpGWF4AaABAg,UCVyXTLyT_8cy5xdjw-LdAxg
tMIDpbmFoL8,UgwyUhFxrMENPf0ASG14AaABAg,@psycho_diary,2025-04-12T14:30:20Z,0,A soul healing dose after a panic attack day is everything I needed. Thank you for sharing how life is too good to worry.,0,,UCwDvc9FJzB6ny0IUN1-X04g
CxVXvFOPIyQ,UgxKKVgRwUJ8hPx4XVB4AaABAg,@seiyachan,2025-09-04T06:27:44Z,0,Apparently same thing happens for mRNA vaccine they called it.,0,,UCdFFLhnpDDZRQwUDoh_pVsg
za_HO2E3JEU,UgwTv2TupJatWj2Blpd4AaABAg,@camiloordonez,2025-07-25T01:58:15Z,0,Sloths:,0,,UCrOdvkNBxZOfocKPl8yia5w
CxVXvFOPIyQ,Ugwr9afKAUOmGvI3nN94AaABAg,@LatinaGaming88,2025-09-01T05:42:26Z,0,Monsanto literally committed treason,0,,UC5NTCgPTbenY9HvSFFrEB8g
E4Ba84ak570,UgyXdETvtn6ay4IxtRR4AaABAg,@Gyattlover101,2025-09-09T21:24:09Z,0,This made my day,0,,UCoABn7lzk5PDtOi7hOSI7iw
ly6YKz9UfQ4,UgwYWaqioJGLEQt2V7J4AaABAg,@fellzer,2025-08-26T01:52:41Z,0,"Hey goy, tell us about your new handlers.",0,,UCnYMpXDl9TKP2Ja0nk9qeHw
zQ2ZJuUJeyo,Ugx449BXw82xQUyn97F4AaABAg,@jbbarr229,2025-08-25T11:45:47Z,0,Literally who just happens to have that many to throw in a pool THEN swim in??? You just wasted a ton of money and time you twit,0,,UCTDlYtUXWbveyl80aRglXyA
pgeTa1PV_40,Ugwj5hOZ7l76UTX4jKR4AaABAg,@coyotestalker364,2025-07-08T01:07:57Z,0,This is honestly so cool,0,,UCfIB8Vb99zlhhHk8XlpWRUg
qeQCVcBWqis,UgwdqFn0-BvtD5MLIL14AaABAg,@joynabbegum5631,2025-09-10T16:48:08Z,0,That is the worst design with the worst color combo for pro and pro max model,0,,UCw4ktAqJkrGsKTAx-hOAPZw
qPen-cHdYmk,UgxuVU_y5zdOnyUUghx4AaABAg,@VinceW187,2025-09-11T16:11:12Z,0,"CGI Linus painting the room, poor Dennis in the green suit",0,,UCD4PSzX3NUKfKqX9uJbnoYg
qeQCVcBWqis,Ugz-P7ig12q_aGomErp4AaABAg.AMtEJFqx2uiAMtFXkAjEfP,@hamibami92938,2025-09-10T10:11:00Z,1,Same here. So sad that only gaming phones are the real option at the moment for that,1,Ugz-P7ig12q_aGomErp4AaABAg,UCoTmvTSFt6vhp4G9RxAdc2g
tZ8ehplVFp4,UgxgfOhVQs4d4qIeZHV4AaABAg,@bakensaken352,2025-09-13T08:11:36Z,0,I guess thankfully to system of sensors in the future such fuckups will stop happening,0,,UC3wf29i657CvEhickgqtPQA
pVI_smLgTY0,Ugy5nbkUogMa6DBx9U94AaABAg,@TheEditorify,2025-04-28T16:37:10Z,0,How do you play games? Do you use proton?,0,,UCysFIT2rnO_RNezArdEz5aQ
lYDE3oq6fL4,UgyPWF5H73VChggDy7l4AaABAg,@sydmdtahir,2025-09-08T17:13:30Z,0,"""They are ugly but they should work"" 
BYv7k6wQyEQ,UgzSRid3Qlyw1uPa7cp4AaABAg,@adityak5951,2025-08-30T17:20:25Z,0,I thought that it was going to be THE END UPDATE,0,,UCax5_VDKKmuUO_OUeP9LE5w
zQ2ZJuUJeyo,UgwqFsyeInvJN4ZFI6d4AaABAg,@danielwalker8480,2025-08-25T21:17:33Z,0,Not true because they would be sinking if the6 werenhevay,0,,UCgGR4qXnUqmH1o4OfoCdafw
KZeIEiBrT_w,UgwiTuCyzwZc6vbtABl4AaABAg,@amvedin,2025-09-03T12:02:44Z,0,I want to know when will the 36 trillion dollar debt be paid? If it can't be paid when will it result in a market crash.,0,,UC1522SsPOopoWWrr17Yn2Lw
u_Lxkt50xOg,UgxI-UrG6sAGznqV_Ox4AaABAg,@Bainkowalski,2025-06-27T05:58:07Z,0,"Big enjoyer of Librewolf browser, Startpage search engine, extensions Ublock and Privacy Badger on Fedora Linux. It's crazy to see a video like this in 2025 but glad people are finally catching on!",0,,UCtVFeLd2tI4O5cQi-qb7WPg
MhRGfNkw3Vo,UgzyMBIQk7b_1Znsrip4AaABAg.AKinybh-NwRAKjLYz73zo7,@SisakBarna,2025-07-18T20:48:24Z,0,​@@rwoosh6609you are right i am sorry,1,UgzyMBIQk7b_1Znsrip4AaABAg,UClANNaWvborCXX0A6Z4WE7Q
CxVXvFOPIyQ,Ugz9FxSLsZfkiSsPDQx4AaABAg,@MrShidimaOne,2025-09-05T14:01:04Z,0,"How can you, as a human, approve this? What is wrong with you?",0,,UCeyOLgC-g_Vv4lkfrEJ19Ew
